{
  "$schema": "../contracts/prototype-review-decision.schema.json",
  "schemaVersion": "1.0.0",
  "prototypeVersion": "mobile-v2-option-2-growth-v2",
  "reviewStatus": "approved",
  "roles": {
    "product": {
      "decision": "approve",
      "reviewer": "yuzili",
      "reviewedAt": "2026-08-11T10:00:00.000Z",
      "evidence": [
        "harness/requirements/mvp.md",
        "harness/prototypes/mobile-v2-traceability.md"
      ]
    },
    "interaction_visual": {
      "decision": "approve",
      "reviewer": "yuzili",
      "reviewedAt": "2026-08-11T10:00:00.000Z",
      "evidence": [
        "prototype/mobile-v2/design-qa.md",
        "prototype/mobile-v2/pad-design-qa.md"
      ]
    },
    "client": {
      "decision": "approve",
      "reviewer": "yuzili",
      "reviewedAt": "2026-08-11T10:00:00.000Z",
      "evidence": [
        "harness/contracts/assessment-api.md",
        "harness/contracts/assessment-task-state-machine.json",
        "harness/contracts/responsive-layout-v2.json"
      ]
    },
    "backend_algorithm": {
      "decision": "approve",
      "reviewer": "yuzili",
      "reviewedAt": "2026-08-11T10:00:00.000Z",
      "evidence": [
        "harness/decisions/assessment-pipeline.md",
        "harness/contracts/assessment-result.schema.json",
        "harness/contracts/cloud-data-model.json"
      ]
    },
    "test": {
      "decision": "approve",
      "reviewer": "yuzili",
      "reviewedAt": "2026-08-11T10:00:00.000Z",
      "evidence": [
        "harness/prototypes/mobile-v2-state-matrix.md",
        "harness/scenarios/core-flows.yaml",
        "prototype/mobile-v2/design-qa.md"
      ]
    },
    "privacy_compliance": {
      "decision": "approve",
      "reviewer": "yuzili",
      "reviewedAt": "2026-08-11T10:00:00.000Z",
      "evidence": [
        "harness/reviews/privacy-and-data-compliance.md",
        "harness/contracts/cloud-data-model.json"
      ]
    }
  },
  "issues": [],
  "updatedAt": "2026-08-11T10:45:00.000Z"
}
